{"schema_version":"un.readout.request.v1","app_version":"0.2.0-d1-i4","start_date":"2026-09-23","end_date":"2026-09-25","timezone":"America/New_York","fixed_topics":[{"id":"topic_d4328f17fc46","label":"Iran","include":[],"exclude":[],"matching":"literal_phrase_with_boundaries_v1","semantic_expansion":false},{"id":"topic_950662956e75","label":"Cuba","include":[],"exclude":[],"matching":"literal_phrase_with_boundaries_v1","semantic_expansion":false},{"id":"topic_5c86f5a8ea4a","label":"Ukraine","include":[],"exclude":[],"matching":"literal_phrase_with_boundaries_v1","semantic_expansion":false},{"id":"topic_803b3eb2b6af","label":"Artificial Intelligence","include":["AI"],"exclude":[],"matching":"literal_phrase_with_boundaries_v1","semantic_expansion":false}],"discover_themes":true,"discovery_scope":"all_eligible_source_texts_independent_of_fixed_topics","source":"demo","external_processing":false,"email_delivery":"draft_only","requested_at_utc":"2026-09-28T17:45:02Z"}